text,label_raw,stars,char_length,word_length
This place was clean and the service was top notch! It is a cross between a Dairy Queen and a Carl's Jr. If you are hungry - get your hamburger with 2 patties - they are kinda slim. The fries were great and they have a ton of frozen custard desserts.,2,3,250,51
"We came here as an alternative to Pho Kim Long, which is always frequented when in Vegas.  The only things better about this place than PKL are that it's cheaper and they have really generous portions.  \n\nThe food was meh.  Their nem nuong rolls are huge, but that's cause they stuff it with lots of vermicelli noodle.  The nem nuong itself resembles and taste like sausage.... no pun intended. And theres like 2 pieces of it..  It wasn't terrible - just not very nem nuongish..\n\nThe rice plate that I had (bbq pork chop) was alright.  I thought it was a bit too salty.  And i asked for an egg over easy, but they fried the hell out of it.\n\nI didn't expect awesome service  - I never do when I go to a Vietnamese restaurant. But on top of mediocre food, they have terrible service.  Therefore, the verdict of this review is 2 stars.",1,2,838,153
"I am still a big fan of Miko's.  The only advice I would give is that do not go there when they are packed and you are hungry.  We went there on a fairly busy night.  All the tables were taken so we waited about 15 minutes for a table to open up.  When we finally got seated, it took a while to get our drink order and then quite a while until we got our items ordered.  After placing our order, it took about 30 minutes to be served.  They were not complicated items.  I ordered their Vegetarian Yakisoba and my partner ordered a vegetarian sushi roll.  My dish came out first and the veggie roll took another 10 minutes to get there.  I don't know what the hold up was considering most people were not having sushi and we placed the order 30 minutes ago.  My partner was a bit disconcerted because  we loved their veggie rolls before.  This was not up to par from our previous experience.  My yakisoba was awesome.  As I said we are still a big fan of Miko's.  They just need to streamline their service when they are packed.",3,4,1027,196
"We brought home a puppy from the shelter 8 days ago with a respiratory infection. She was on medication for a few days, and then in less than two days' time, she got very worse. \n\nWe rushed Milly to this location at 3AM last night. She was in a lot of pain and had the hardest time breathing. The staff members were friendly for the most part and pretty knowledgeable. They wanted to hospitalize Milly for a few days to run some tests on anemia, tick diseases, and other various long-term potential health issues. We were quoted that the treatment plan may range from about $4-5,000. We don't have that kind of money. We decided that these tests could wait until the morning - we just wanted to get her breathing normal, and if she had anemia or something long-term that our day vet could help us for a fraction of the price in the morning. We accepted some antibiotics and a fluid injection, because a few hundred dollars was the most we could spend at the time. They kindly gave us some recommendations for at-home remedies as well.\n\nMilly passed away later in the night. We took care of her most of the night to the best of our abilities. Even if we had known that she would pass away so soon, there was no way that we could have afforded to have her hospitalized. I just wish that we could have done something to help her immediately, instead of spending thousands on the unknown.",1,2,1388,255
"Yalla is taking steps in the right direction and making improvements. Fantastic fresh pita, good service, clean environment and tasty food. They seemed busy this time because of some kind of promo. My only gripe was, people were waiting to sit because all of the tables were still dirty. They were dirty when I walked in and continue throughout my duration. All in all...good Job! On a side note; the pita really makes this place special and unique. I hope hey continue to improve! I will give them my business now.",2,3,515,91
"Good coffee, nice wooden vibe, but whoa, the volume! The combination of deliveries, staff and a few early morning students was quite a jolt with which to start the day. Yeah, it's a noisy, busy part of town, always bustling - but this is a caffeine den, not a peaceful bolt hole - just to let you know. \n\nEnjoyed the free wi-fi, though my clothes smelt overwhelmingly of cooking for the rest of the day after just a morning coffee.\n\nGood for a strong coffee hit if you're in the area - you'll be lucky to get a seat, though, as it's really, really popular.",2,3,560,104
"This was my first encounter with any all-you-can-eat establishment, and my two outings here have been pretty good.  China China is in the Omni Centre, which also houses a Vue cinema, Wetherspoons, gym and others.  It thus offers plenty of choice for those visiting the centre who want to eat, and it seems to complement the other choices well.\n\nLet's be honest at the outset - not all of the food on offer is Chinese.  I'm sure I saw a curry or two, chicken nuggets, chips and waffles thrown into the mix as well.  The food is satisfying, if not amazingly tasty.  I guess this comes from having the food sat out for a while.  At my last visit, dessert was where the night really came together, and I consumed something like 12 pieces of cheesecake (an all-time favourite dessert for me).\n\nI would say that the prices are reasonable for the food that is on offer.  There is a small bar, but I find that it is best at these places to just get tap water, to add as little to the fixed price of the buffet as possible.  The interior is contemporary, if a little clinical, in style - but this won't  bother most diners, who will be focused on consuming quantities of food.  The few staff that I did see kept the food stocks high throughout the evening, but to be honest they played little role in creating the experience.\n\nWith China China, you get what you pay for - an all-you-can-eat buffet, and not much else.",2,3,1414,257
They have really good cheap sandwiches for lunch,3,4,48,8
At nails of the world they actually care about u as a person. They do great work & my polish never peals. They are Always friendly. I've been going there for a couple years now & I would recommend nails of the world to anyone of my friends & family.,4,5,249,50
"Review based on an overall experience.  I have stayed in a Tower Deluxe Room in the East Tower, a Suite in the East Tower, and a Pyramid Deluxe Room.\n\nLast year I was playing Blackjack for 4 hours at Luxor and since then I have been getting free rooms, basically at my disposal.  The perks of being a Gold Member with MLife.\n\nThe rooms at Luxor are average size sat around 450 sq. feet. They come with all the basic necessities: somewhat comfy bed, iron, safe, bath amenities, tv.  There is nothing great about these rooms, but at the same time there is nothing bad.  The bathrooms are bigger than the ones at The Mirage and have a separate tub/shower.  This is one thing that makes these rooms better.  But what MGM and The Mirage lack in the bathroom department, they make up for in swankiness.  Luxor's rooms are blah. The decor is old, the carpet is blue and the overall feeling you get when you walk in is.... When are they going to renovate?\n\nOh, and there is no W-Fi inside their rooms.  Ethernet cords are available. (Pssssst, wanna know a little secret?  There is Wi-Fi.... Only in select rooms in the West Tower. They are currently testing out their Wi-Fi)\n\nTheir pool area is pretty basic.  A couple of small pools and cabanas that are basically tarps protecting you from the sun. Please don't waste your money.  Nobody at the Luxor pool cares that you have a cabana.  The restaurant choices at Luxor are pretty slim. Their Mexican restaurant \""Tacos + Tequila\"" and Asian restaurant \""Rice & Company\"" is way overpriced.  There is a food court that has the usual places... Pizza, chicken fingers, burgers. Nothing special.  A few Starbucks are scattered within the property. \n\nThere are a few shows at Luxor, Jabbawockeez and Carrot Top. I wouldn't waste your time and money on Jabbawockeez.  I was a fan of theirs on America's Best Dance Crew, but apparently they are only entertaining performing in 3 minute segments on TV. Watching them for 1.5 hours was a little too much of the same thing over and over again.  Carrot Top on the other hand is hilarious.  I saw him years ago at MGM but I'm sure he's just as funny at Luxor.  I would definitely recommend Carrot Top to those who are familiar with pop culture though.\n\nOverall, I don't think I would go out of my way to stay at Luxor.  Having the room be free is a nice perk, but I would prefer to stay at Monte Carlo as it's more centrally located and the rooms are a little more updated and modern. \n\nIf you're able to get a good deal ($50 or under), don't mind walking to where all the action is, and are too drunk to care about what your room entails, then by all means, get your LUX on.",2,3,2670,480
"Just awful, the service is horrendous and I come here at least twice a week, well not any more .. If they are busy or not they don't acknowledge you, and they screw up the simplest order \""Everytime\"" I'm patient I have been in the service industry... Sometimes was they just put your food in their toaster and forget about you... Never again ... I'm finding an Einstein bagel..  This place sucks!",0,1,397,72
"I'm hooked on Pepper's bean and cheese burrito. Awesome flavor and portion for a great price. The same girl is working there every time I go in, and she's always so friendly. She knows me by name, and she has my order down. I have yet to try another dish (aside from the cheese fries, which are delicious!), but I'm sure it's just as fresh and scrumptious as their bean and cheese burrito.",4,5,389,73
Unfriendly and unhelpful service. Our shrimp was undercooked and noodle dish had no flavor.Will not be returning.,0,1,113,17
Came here about a month ago and the frozen yogurt was good but I won't be coming back. There was a foul smell upon entering the shop and a bunch of gnats flying around the fresh fruit they had for toppings. It was a shame because my prior experiences were good but this was very off putting. I'll probably wait a long time before going back or find somewhere else...,1,2,366,70
"Whatever you do, AVOID HERTZ AT ALL COST AT THIS AIRPORT.\nSince, 2011, I've probably flown into Phoenix 3 or 4 times.  Each and every time I had a reservation and my name wasn't on the Gold marquee when I arrived.  After waiting in line at the GOLD booth, I then had to WAIT for a car.  This rarely happens in any other city.  And, If this is the way they treat a preferred GOLD member, I can only imagine how other non-status customers are treated.  If this were an isolated incident in Phoenix, I could understand.  But, 3 or 4 times in a row is just simply poor management and incompetentence ... and they are not at all apologetic.  Just last week, I almost missed an hour of the meeting because I was waiting 45 minutes for a car.  Ridiculous.\n\nHere's the best part ... they sent me a survey and I have them horrible rankings.  The lowest score on the \""recommend\"" scale.  Do you think anyone bothered to contact me?  NOPE.  :)   Then, a week later, they had the nerve to send me an e-mail asking if I would like to post my comments on various social media sites.  Now that's some really incompetent target marketing if I've ever seen any.  \n\nEven though this is who I my company negotates rates with and is our preferred rental car providor, I'll have to choose a different providor at this airport.",0,1,1311,239
"Finally got a chance to try this place out.  I have heard mixed reviews and wanted to see for myself.  I was told the service was terrible and it was an accurate statement.  For our party of 9 we did get a table fairly quickly but that's where the speedy service stopped.  Although our server Kelton was awesome, seriously he was great, we loved him, it took FOREVER for our food to make it to our table.  It appeared it was definitely an issue with the kitchen.  Not only were we waiting a ridiculous amount of time for our food, once the food started trickling out, it took a while for the entire table to get their food.  I ordered the beets, they were cooked well and great flavor and I ordered the Mac and Cheese which was delicious.  My husband is a vegetarian and it was slim pickens for choices for someone who doesn't eat meat.  He ordered the veggie burger and surprise they were out of it so he ended up with the grilled cheese which was forgettable.  When it came time for dessert they were out of peaches for the peach crumble.  I'm going to assume they use extremely fresh ingredients to be out of so many things.  Overall we enjoyed it but very timely wait for food.  Again Kelton was great!!",2,3,1207,225
We stayed at Mandalay Bay for a long weekend and I ended up at Border Grill a couple times.  The 4 stars are really for the weekend brunch - all you can eat tapas that were interesting and (mostly) tasty.  I went back for the margaritas later which were also tasty though not particularly cheap.  You'd think the upstairs patio would be a good place to watch the beach concerts but the waiter said it was too dark to see the stage. Alas.,3,4,437,83
"Good vibe & lively on a Wednesday night - a hip Vintner Grill of sorts. Mrs. Wynn's ever-present glowing embers burn into the soul, as they celebrate the deadly sin of vanity. \n\nWorld renowned DJ Steve Angello (Swedish House Mafia) had put together a fantastic collection of old school rock mixed in with progressive house tunes. The mocktail was good - gingery & refreshing. Best to stick with the appetizers aka 'table shares,' which were truly delicious. The entrees (gulf shrimp, sea bass, salmon sushi, and crispy noodles) were a bit 'meh.' Cake pops were too sweet but fun to look at. The food took its time but at least the server had Channing Tatum's good looks.\n\nTip: if you get a table at Andrea's (Aan-dray-aaz), you can skip the line & entry charges for Surrender Nightclub.",2,3,790,136
"over-hyped TGI Fridays.\n\nAte here on a business dinner while in Phoenix.  It was not a memorable experience and I would recommend that anyone considering going here takes a look at anywhere else nearby.  Five-Guys burgers would be a better bet.\n\nSorry, not a place I would like to return to",1,2,294,49
"This is for Deb:\nI drove to the box that talks back.  I ordered a Quarter Pounder with cheese meal.  With a Diet Coke.  Yeah, I drink Diet.  Not because I think it will even out the bad of the meal, simply because that's what I drink.\nI got my food quickly.  I barely remember eating it and gave the last few bites of my burger to the dog, along with a few fries.  The fries were good.\nThe ice in my cup was really, really cold.",1,2,431,84
Great food and great service!,3,4,29,5
"A company that used to have great customer service and on-time flights that has deteriorated to unacceptable levels. I used to fly them almost exclusively but wondering if your plane is going to arrive with each trip forced me to switch. And anytime you had to talk to someone good luck...they always seemed annoyed when dealing with customers. That was 2 years ago. \n\nAdvance to 2014 and I have some miles left that if I don't use I forfeit. So I decided to take a trip to Vegas. The flight out was only a few minutes late - not bad. The return flight? Well I'm still waiting to get home and I'm on standby for the next 2 flights - both of which are oversold. Tried to work with an agent to see that my options were and rudeness and lack of empathy don't begin to describe her behavior. Never even an apology - no service recovery attempt at all. I've written to their customer service department and will update this review when/if I get a response. \n\nSo this will be the absolute last time I use this airline and gladly so. Even a \""free\"" trip using miles isn't worth the way I've been treated today. \n\nUse a competitor - you'll be better off. Good luck out there.",0,1,1174,218
"I'll start off by saying this place is adorable - a converted craftsman now a restaurant. The fireplace, the beautiful windows, a stained-glass divider between adjoining rooms, the entry foyer off the porch, etc. I had a warm feeling about the place.\n\nUntil we sat down. \n\nThe dining room is one small and very \""open\"" room, so sound does travel all too well. Sitting directly behind my dining companions was a girl with an incredibly loud laugh that sounded like she was being stabbed. I felt that our table was in the middle of a thoroughfare - similar to the table directly next to us. It was hard for servers and other patrons to squeze by, presumably to go to the bathroom  - which I didn't go looking for myself but which sounds hard to find based on other reviews.\n\nI watched with confusion as the table next to us, with their food on the table, was asked to stand up so their entire table could be moved three feet to one side. I don't know who requested this move (the server or the patrons), but I thought it was odd that it didn't happen until after food was served.\n\nOn to the menu.\n\nEverything sounded excellent on paper. And I get that they are trying to capitalize on Charlotte's current obsession with \""wine\"" and all things related (ie. wine tasting, wine pairing, wine bars, wine cultchah, etc.) This confused half-Frenchy half-Southern menu may just need to pay more attention to its audience. If you're supposedly a comfort food bistro, then part of that comfort should come from consistently good service and consistently prepared dishes. \n\nIt seems Lulu needs to know where her bread is buttered. \n\nMy friend ordered a dish he has ordered frequently (something with shrimp), but was surprised to see it come in a soup bowl full of watery liquid. He looked at his wife and said, \""It's usually not served like this - isn't it supposed to be much thicker?\"" \n\nOur coffee sat unfilled after one teeny tiny (read: French?) sized cup, and my friend's special of the day omelette was good but not great. My omelette and bacon were not very flavorful, but I did like my other side item - something cleverly called \""morning fries\"" which were really the old pomme frites redone the morning after with some really good spices (garlic, peppers, mmmm).\n\nWhen in Rome, or is it France, or is it the New South?....\n\nI should have had a mimosa.",2,3,2375,413
"The burgers here were good but not stellar. I had a chicken burger with brie, smoked bacon, and shallots, while my friend had the \""le classique\"" beef burger with brie and some other toppings that have slipped my mind. All burgers come served with lettuce, tomato, red onion, a pickle, and your choice of house-baked bun. We also ordered a french fry sampler of skinny and waffle fries. The fries were outstanding--perfectly crispy and seasoned, with no greasy residue. The mistake we made was that we ordered a sampler, when one order of fries is more than enough to feed two people with average appetites. Our server was Nicoletta and she was very friendly and provided excellent service. The price was reasonable, and they have great Happy Hour specials. Would we go here again? There's a slim possibility, but there are so many great burger joints in Las Vegas, this would be on the bottom of our list. In the future, come here for the Happy Hour specials and the french fries. They also have lots of flatscreens, so this would be a good option for those who want to watch the game over a beer.",2,3,1099,196
"overpriced over-the-counter candy.  also, my daughter saw the hello kitty pre-packaged candy (she's 2 years old) and started fiddling with the containers. not banging around, not throwing.  she would take them out of the box then put them back in.  yes, it's probably mildly annoying. but she's 2, and it IS a candy store. \nemployee came and reprimanded her.",0,1,359,59
I went to this place while traveling in the Quebec area and had EXTREMELY rude service. I arrived here at 11 sharp which I thought was when they opened. The door was open and I was able to see the workers in the kitchen. I did not go inside but was standing on the doorstep. A young woman who looked like the owner said something to me but I wasn't able to hear because the restaurant was right next to a busy street. I asked the woman again and she answered that they open at 11 30 very rudely with an angry expression. Of course I did not go back to the place again. They might have good food but the most important thing should be respecting customers.,0,1,655,128
"I know this is a place for seafood but trust me, the bone in ribeye is one of the best in the valley and yes, I've been to Ruth Chris, the steakhouse at Circus Circus and SW Steakhouse at the Wynn. \n\nMy server James definitely knew the menu and suggested some great items but for the most part, all of the servers are friendly, attentive and know the menus and the sommliers know their wine.  I've been a loyal customer for a few years now and dine in this place for lunch and dinner about once every four months. \n\nFor appetizers, I like the huge grilled Madagascar shrimp with the lemon sprayed on it. When the stone crab is in season, it is always good to order, especially because it gives you an excuse to get some of that tasty tartar/mustard sauce it comes with. \n\nThe place has a front section that is casual but a back dining area for more intimate settings as well as an upstairs area for private parties. They touch all the bases.",4,5,947,177
"This is my new favorite pizza restaurant. I must say the pizza is better than Metro. The pizza is very d-e-l-i-c-i-o-u-s. It doesn't have that fake cheese taste. As I am writing this review, my boyfriend is considering picking up pizza from here. We eat here at least once or twice a week. My favorite the cheese pizza, great price. Highly recommend trying this place out. Spread the word about this restaurant.! You definately will not be disappointed.",4,5,453,78
"Cornbread Update:\n\nI think they must have tweaked their recipe, because I tried a piece of the vegan cornbread again and it was perfect. Thanks, Weary Bakers!",4,5,160,26
"Was here last night for a Family Soft Opening. This used to be Carmine's but was gutted and looks great. Plenty of TVs to watch the game. \n\nThe food and drink selection was excellent. The \""Mad Mule\"" was a great cocktail. Food was excellent, very large portions. I enjoyed the Chicken Salad and it was delicious. \n\nI have high expectations for this bar. Hopefully becomes the new local spot!",3,4,396,69
This company rocks! We had no worries knowing they were caring for our pooches. They were diligent and detailed with their care.  We will definitely use them again and our dogs look forward to it too!,4,5,200,36
"I got a deal from Priceline but it's still expensive for what it's worth.  The guest room that we are in is really no different than what you might get at three star hotel.  The front desk and and receptionist aren't too friendly. The check-in process was disorganized. The room itself is older.  There is limited furniture and you can hear everyone in the hall.  The bed is comfortable though with clean sheets and a comforter that gets washed just as often. \n\nThe first room we were assigned to the key cards didn't work and people were making all sorts of crazy noise at noon across from us.  They moved us to another floor with working key cards.  The elevator setup seems efficient to regulate flow of traffic and the rooms are spaced well from the elevator. \n\nThe best perk about the room is the semi-large flat screen TV and the pretty bathroom tiles. The water pressure is very strong, too.  There is also a nice magnifying mirror, but in general the bathroom is small. \n\nMajor cons are small room and bathroom size, dated look, marked up walls, old furniture, no ice bucket, no fridge, no water heater, limited sink space.\n\nThere are a lot of on-site amenities... restaurants, food courts, and more. Also, this hotel is directly next to 24 hour CVS and Walgreens if you need anything. \n\nWe are only here one night in December.  We didn't use the pools.  I remember being here about 9 years ago and I liked the pools. Looks like the decor hasn't changed since then.\n\nAlso, the WiFi is spotty.  My iPad didn't pick up any connection but my MBP did.\n\nWe leave tomorrow night. I may write when our stay is finished. As of now my opinion is that it's a decent hotel, but more of a 3-star quality and overpriced for what it's worth.",2,3,1749,311
"Love a good local beer, this is the place to stop and shop.  The 7th street public market is complete with vendors and a great place to enjoy lunch, grab a few unique things and enjoy time with friends and family it's got something for everyone. \n\nNow Tank's Tap is a new favorite, great local beers on tap and plenty of other craft beer in the fridge. Staff is fantastic and oh so friendly, grab a beer and order something to eat at one of the great lunch spots and they will bring your order over to you at the bar. \n\nSports fan no problem games are on the TV, just a fun spot all around to enjoy a break. Oh and their growler fill system keeps your growler fresh for 2-3 weeks.  Love this place!",4,5,702,136
