text,label_raw,stars,char_length,word_length
"Good call Yelpers, good call.  Full disclosure, I've had barbecue at some pretty famous establishments in Austin and Kansas City.  While this place doesn't have the history or the reputation of some of barbecue bastions of the world, this is definitely among the best barbecue joints I've been to in the valley.  Perhaps that might not be a high bar to clear, but its definitely worth a try.\n\nAs with so many barbecue joints I've been to, this location seems to have a goofy disposition.  This particular establishment is located in a row of storage warehouses right across the street from Deer Valley Airport.  You really have to be looking for this place as the exterior blends in with all the other businesses in the complex.  Once inside though, the story changes entirely.  I was warmly greeted by a gal at the register as the lunch crowd came streaming in.  Their meat smoker is right behind the register filled with slabs of brisket, ribs, pork, and sausages.  The smell wafting into the front counter is heavenly.  Theres a tiny amount of seating up front, but there's a bunch more around the corner in back.  The back is basically an industrial garage thats been turned into a sports lounge of sorts with multiple TVs showing ESPN channels, a bunch of booths as well as table seating in the middle.  Not fancy or pretentious at all, but very relaxed.  If it had a bar, it'd be perfect.\n\nBeing that this was my first trip, I grab a sampler plate.  You get pulled pork, smoked chicken, and smoked sausage along with two sides.  For a little extra you can substitute a meat for brisket.  Being that brisket is their calling card, I exchanged brisket for chicken this time.  I got BBQ beans and waffle fries as my sides.  And got a couple of soft rolls to make sandwiches with my meats.  I grabbed a booth seat in back since the front was already getting crowded.\n\nSo let's get to the verdicts on their food.  And for the record, I typically like to eat my BBQ without sauce as the best barbecue doesn't need it.  For starters, excellent brisket.  Nice smokey flavor with a pronounced smoke ring to match, tender and juicy, and a nice portion.  The sausage's smokey flavor was a little less pronounced, but plenty juicy and flavorful as well.  The pulled pork was also good, though perhaps a little on the dry side.  The beans were a little bit of a bust as I didn't taste any BBQ flavor in those.  I actually got the waffle fries so I could try their four sauces which are provided at the table.  Of the four, I actually like their mustard flavored sauce best.  The mustard gives it a little tangy zip that adds to the flavor without being too spicy.  They also have a sweet & mild sauce, a smoked tangy sauce, and a hot & spicy sauce (it wasn't all that hot in my opinion).  I applied a little of the mustard sauce to the meat which was great, though as I said great smoked BBQ doesn't need sauce.\n\nTotal for the sampler plate (including the brisket substitute and two sides), 2 rolls, and fountain drink was $15.  Good lunch portions that left me satisfied without feeling uncomfortably full.  I was in and out in less than 30 minutes.  The place was really getting busy as I left so the average time spent here might be a little longer than that.  \n\nAfter eating here I still give a slight edge to Bobby Q's as the best in the valley, but POAF can certainly hold their own, especially on the brisket.  In the end, its not Bryant's, or Franklin's, or Salt Lick.  But if the Phoenix area is going to get into the barbecue sweepstakes going forward, it will be competition style BBQ joints like Pork On A Fork that will be forging that path.",3,4,3657,658
"I had a problem with a coolant leak on the top of my 2008 Ford Expedition engine.  I had had my AC repaired a year earlier at this shop without concern so I when to Greulich's on Ray Road again to have them provide me with an estimate to repair the coolant leak.\n\nI arrived about 4 PM on a Weds and explained the problem.  With little discussion, the Service Writer (Kelly15) took my keys to have a mechanic \""take a look\"".  There was no discussion about any fees to get an estimate.\n\nAbout 45 minutes later, I was presented with an estimate of $1,558.93 to have a couple hoses replace and to remove and replace the engine intake manifold.  I was dumbfounded because it was obvious that the hose was leaking at some of the manufacturing joints and spraying down on the engine.  I challenged the Service Writer and said I didn't think the manifold was the problem.  He assured me that his \""Master Certified\"" mechanic confirmed the need of manifold replacement.\n\nIn disbelief, I said that I would have to have another garage provide me with an estimate before proceeding at which time, I was asked to pay $58.50 plus tax for the mechanic's time.  Bull S!, I was never advised that an \""estimate\"" came with a $58,50 shop bill.  With a firm (read LOUD) voice, I said \""I'm not paying your bill\"" and my vehicle was returned to me.\n\nLong story short, I purchased the replacement hose assembly from a retail automotive store and the necessary antifreeze to replace the hose.  After 200 miles, I observe no additional leakage.  Total repair cost in parts was $139.95 and a couple of hours of my time.  Total SAVINGS to me $1,418.98.  \n\nIt goes without a second thought that I will not be using Greulich's services and will have reason to tell others why I have reached my decision.",0,1,1788,315
They have good kettle corn,2,3,26,5
"It's not your mother's spa...it is your grandmother's spa. Literary. The resort is mostly occupied with senior citizens, though nothing is wrong with that. The spa is on the smaller side and looks old. It is also quite dark in comparison with other sun-infused Arizona spas. I was mildly grossed out seeing the toilet stalls adjacent to and facing the jacuzzi area, but, after consideration, it must be gerontologically-appropriate. To make matters better, there are two wheelchair-accessible showers strategically situated in between the toilets and the jacuzzi.   \nEverything else was uneventful and I did not stay long.",1,2,623,97
Suggestions :\n\nBook an Appointment. \nHave a lowered car?  \nDefinetely book an appointment in advance. \n\nAndre was honest when I got in. He said he would try to squeeze me into their time slot. Dealership quality service at a small shop location. Will probably do my major work at this location.,4,5,300,50
"Every time we visit Vegas we come here for a boba milk tea as a special treat. The ladies at this store are always nice and the teas come out very quickly, even if there's a line.",4,5,179,37
"Meh... Love that it's local and the food isn't usually bad. Just expensive.\nI feel like I'm in the middle of an identity crisis when I'm there. They want to charge fine dining prices, but operate as a mom and pop. Tonight the service was poor and the \""homemade\"" pasta was chewy. Nobody asked so I didn't mention it.  Oh and the bartender/server didn't have her long hair pulled back. Ewww! Whenever I hear \""can I get another one\"" from more than a few customers, I realize it's not just me. In this economy going out to dinner is a treat for most... I hate it when restaurants forget that.",1,2,593,109
"We were invited to go to Vegas to celebrate the birthday of one of my cousins during the last weekend of July and needed a cheap motel to crash at when we weren't perusing the strip and generally having a good time.  Soooooo I went out to expedia.com and found this place.  It was reasonably priced, and the location was good, so I booked it.  Then, the day we arrived as we were waiting to checkin, I read the Yelp reviews and began to get a bit nervous.\n\nTo be honest, this isn't a bad motel.  It's not really a great hotel either.  We experienced some good and some bad with this place.  I'll summarize below.\n\nGood:\n * Location!  This place is just off the strip, about a block away from the \""4 Corners\"" area where the Tropicana/MGM Grand/Mandalay Bay/Excalibur are, along with New York, New York nearby as well.  Its an easy walk to these resorts.\n * Coco's!  The place is situated right behind a 24 Hour Coco's!  And the Coco's is one of the best food deals in town.  The food is great.\n * Air Conditioning.  The A/C worked very well.  In fact, it was almost arctic!  A must in Las Vegas.\n * EPIC Water Pressure!  The water pressure for the shower was wonderful!  Hot water remained hot for ages.  I've had crappier water pressure in much swankier hotels.\n * Management.  They were quite friendly and were able to give us a ground floor room.  The wifey is slightly disabled and stairs and she don't agree often.\n * The Beds!  The bed was actually quite comfortable, and the wife couldn't stop raving about the comfyness of the pillows!  We slept very well - which is something we rarely do in a motel/hotel\n\nNot So Good:\n * Upkeep.  Our tub had some of the porcelain missing and we could see some rust in a corner.  The room itself was tidy enough, but the whole place is in desperate need of renovation.\n * WiFi.  This was one of my biggest complaints.  The WiFi here (an IBahn service) is a FEEBLE JOKE!  You could barely get a signal ANYWHERE and when you did the speed was so slow (really?!  384kbps?!!!) that it was a joke.  I was almost tempted to jump on the WiFi from the neighboring Motel 6 even though it was $3/day.\n * The TV.  I'm not complaining about the tv service per se.  The signal was strong with no fuzz and wifey and I were able to snuggle together and watch Ghost Adventures as we were winding down from the day.  My complaint is the SIZE.  A little 20\"" tv barely does it, people!\n\nOverall, we had a decent experience here.  Many people complained about the \""paper thin\"" walls.  But really, once we were ensconced inside - we hardly noticed the outside world or anyone on either side or above us.  The blackout curtains worked great, too.\n\nThis place is an average place to stay.  Its mostly meant as a place to crash for the night and unwind after the day.  For a basic hotel/motel, it gets a solid 3 stars - even though there are some things that need to be addressed.\n\nThe price was great too.  With my AAA Discount - 3 days/2 nights on the weekend was $100.76.  Not too shabby!",2,3,3036,550
Great service! Excellent menu! Their chateaubriand steak was mouth-watering!,3,4,76,9
"I was craving something last night and couldn't figure out what I wanted. I happened to stumble across this place and decided to give it a try. I ordered the house fried rice and some crab rangoon. Now the crab rangoon were pretty good and I was actually bummed that you only got four but it was only about $2.50 so I cannot complain too much. The fried rice was just ok. For it to be house friend rice, which comes with beef, chicken, pork and shrimp, I can understand not having alot of the shrimp but it didn't have much of anything. I mean it tasted ok, but I was hoping for a little bit more meat than there was. It was a quick meal considering I didn't really know what I wanted to eat anyway. I may give it another try and hope that it's a little better next time.",2,3,771,152
"Yea, it's a Wendy's but great service! Usually when you're in an airport the service is rude, good thrown together, and extremely overpriced. The line was long and they were busy and the employees were always smiling and pleasant. Not that obnoxious fake pleasant either. They were genuine. The food was great! They do charge 31 cents per ranch but that's corporates policy, not theirs.",4,5,386,65
"I'm not one to write reviews but I had to stop what I was doing to let you know how amazing Leah Joy is!!!\nNeed a last minute blow out, make up or color??? Leah Joy is the go to gal to make you feel beautiful. I love the fact that she is mobile and will come to you at a moments notice. She is incredible with an extension blow out (girls, please don't try to do this on your own, it's just not worth it). Want to look like a million bucks??? Cal Leah Joy ASAP!!!\nMake sure you get the \""beachy waves\"" blow out; there is honestly nothing better. She knows how to work the curling iron better than anyone I know. And my blow out can last almost a week. So what are you waiting for??? Make that call, you deserve this special treat, or in my case... Twice a week treat. Now, aren't you worth that??? look and feel your best, Leah Joy is the only person in the valley to call.",4,5,876,174
Feeling generous with the one star today. Food was good but service was lacking. I don't believe that you should have to wait 30-40minutes for water to arrive at your table or watch your appetizer pot steam for that long either.  The bad service outweighed the food this time. Disappointed. Seems like the Melting Pot should read some of these reviews to make improvements.,0,1,373,64
"It was very over priced, burger was just alright, nothing amazing or spectacular. Went with friends who were also just as unsatisfied. One ordered the bleu cheese burger, asked for balsamic vinegar, which he never got. Made his burger suck even more. Fries were cold and not many on your plate. At least fill me up on some potatoes if your burger blows, YA FEEL ME?!",1,2,366,66
"I found this place by accident as it is tucked into the side of a small strip.  There is another place in the same strip but on the other end called Arivaderci....Don't ever go there....Their food is just bad....I only mention them to ensure there is no going to the wrong place!!\n  When I arrived at Giuseppe, I walked in the door and the inside was full but the outside patio area was completely empty.  As I appraoached the counter, the gentleman just said what can we do for you.....I was a little taken aback as I did not know how to answer that.  I figured usually when you walk into a restaurant, they say how many and seat you.  I literally said that I was there for dinner.  He then said I could sit out the patio if I wanted to.  So that is where I went.  I waited for  a while and a waiter finally appeared and took my drink order. Then came back witha menu.  He brought bread (which was totally dry and the \""herbed\"" butter was no more than butter with some parsley in it) and my drink and was gone again.  When he finally came back, I ordered meat ravioli.  That was brought out by someone else....I never saw my waiter again.  I had to wave through the window to get someone's attention to get my check....OK, the raviloi's were good, but the service sucked.  I guess I had to be one of the \""elite\"" customers inside to get anyone to even bring me another drink...I will probably attempt to go here again (I always like to give places a couple of chances before I totally discard them. )  First impressions are important.   Oh, and btw, the tines on my fork were so bent that I ended up having to press it against the table so I could use the fork....It is definitely \""down home\"" Italian.  One last thing, my name starts and ends with a vowel and has a vowel in the middle.....So I know great Italian....This is not great, but is pretty good. The prices are not all that wonderful either...Small portions for the price.\nOne thing no one mentioned....this is a cash only place, so no credit cards or checks.....Maybe it has something to do with tax collection...HMMMMM?",2,3,2088,385
"Flipping great eyelashes!  I bought a pair of these blue feathery eyelashes for a costume party.  I got compliments all night, everywhere we went, on how cool my lashes looked. They were very reasonable at $10 a set.  The most expensive eyelashes they have are $12.  I also asked the sales associate how much it costs to have make up done there...it's $40 for the application or you can get a product and application for $60.  Pretty typical for getting your make up done.\n\nThe sales associate was very helpful.   Asked a lot of questions and showed me their look book so I would have a better idea of how the lashes would look on.  \n\nWithout a doubt, I will be back for lashes.  I'm also planning on trying some of their regular make up too!  Very fun shop!",4,5,762,138
"My daughter took my husband and I for our anniversary last month.  I have to say this restaurant is one of descent Chinese restaurants in AZ since we used to live in San Francisco.  It's a little pricey but we enjoyed the ambiance, good service and good food.  I'm still looking for a non chain good Chinese restaurants since I love dim sum.",3,4,341,63
"J'ai pass\u00e9 devant avec ma copine et un couple d'amis. Ma copine avait envie depuis un bon moment et mon amie solidaire l'a accompagn\u00e9e au toilette, pendant que je regardais les critiques du resto sur Yelp.\n\nMa copine s'est rendu au toilette sans rencontrer personne, mais mon amie a rencontr\u00e9 un homme qui se disait le propri\u00e9taire. Il lui a demand\u00e9 si elle allait vomir! Totalement surprise et scandalis\u00e9e elle lui a r\u00e9pondu NON! Il lui a alors demand\u00e9 si elle allait faire un num\u00e9ro 1 ou 2! Elle a juste r\u00e9pondu d'un hochement inqui\u00e9t\u00e9e de la t\u00eate et s'est d\u00e9p\u00each\u00e9e d'entrer dans les toilettes sombre de l'\u00e9tablissement.",0,1,709,107
"It sounds like the food here is spectacular and I wish I'd have been able to try it. Unfortunately, I'm not cool with being pointedly ignored when I walk in somewhere and say hello to the person behind the counter. \n\nLong story short I walked in, was ignored. Went to counter, was ignored. Got order taken, tried to use a coupon, the lady said \""No.\"" \""I can't use it?\"" \""No.\"" \n\nOh. Alright.\n\nI was ordering the daily special and wanted to use an Entertainment coupon. I'd have understood if she had been really nice and just let me know that she would be losing money on a coupon. Then I'd have pocketed the coupon and went about with the order. I just don't like being treated like a stupid jerk. I get ignored and given attitude like this when I wear a name badge, I don't need it when I enter an establishment to spend money. So I told her I'd just go somewhere else and she shrugged.\n\nNo big loss for either of us, I suppose!",0,1,941,175
"I drove 22 minutes to arrive here at 630pm. Their website says they are open everyday 10am-7pm. When I arrived,  they were putting jewelry away and the door was locked. The lady frown at me when I tried to open the door the first time, unknowingly that there were already closed. I was confused and saw a tiny sign by the door that has different hours for different days of the week. That was a waste of my time amd will never return. Get your website straight!",0,1,461,87
"I visited big view diner for third time tonight and have to say I was very disappointed in the food.  I think there was not even 2 ounces of meat in my stroganoff and what was in there was tough and stringy.  For what I paid for it, I expected it to be good.  It was definitely a letdown and made me think the extra 20 minute drive I took to get good food should be in another direction from now on.  3 pieces of mushrooms and a tiny piece of what was called \""brisket\"" was definitely not worth it.  Service was great which was only reason I put 2 stars!  Too bad food didn't match.",1,2,583,116
"On our first morning in Las Vegas we chose the breakfast buffet where we were staying. It was unusually busy for a Thursday morning due to an influx of cowboys attending a bovine sale as well as the start of the PBR finals.  My breakfast included OJ, fresh fruit with strawberry yogurt, easy over eggs, a sliver of ham, bacon and a Tums. Everything was reasonably fresh.  We used our funbook coupons received at check-in.\n\nWe returned a week later for the luncheon buffet using a pair of free buffet coupons from an additional pair of funbooks.  I enjoyed a few small cocktail shrimp, a tomato salad, one BBQ pork rib, a few tiny meatballs and a fresh fruit tart.",1,2,665,119
"Not very impressed with this joint. This place reminds me of a club/bar you would find in Uptown where being at the trendy place is more important than a well-made drink and good service. \n\nWe walked in on St. Patrick's day to find the place empty (it was during the day). We asked to see a cocktail list and were told there wasn't one. Funny because when I sat down at a table lo and behold there was a  cocktail menu sitting right there. Speaking of the table it was dirty ...along with the sticky menu and the messy floor. To be honest It felt like the closer from the night before never cleaned-up... the bar was unkempt, and downright dirty. Nothing about it made me feel like lounging that's for sure. \n\nWe ordered over-priced vodka sodas which I requested to be served with a twist-of lime. Our bartender told us they didn't have limes. The odd thing was I saw the same individual actually cutting limes less than 5 minutes later....was he that lazy or non-accommodating that he couldn't be bothered to grab a lime from the back and cut it up? Or did limes just magically happen to appear a mere five minutes after our drink was ordered?  He looked like he was completely jacked up on steroids (even had the lime green muscle-tee  to match) so maybe he was on the verge of roid-rage and cutting limes or grabbing a cocktail menu would have sent him over the edge. I suppose I should count myself lucky. \n\nOk, maybe that last part was uncalled for but I was really disappointed with Stashe House . I will say it was a beautiful day so I enjoyed the open seating.  We didn't stay to have another drink but I doubt the bartender cared very much as he didn't ask us how the drinks were or even bother to ask if we wanted another one...or do much of anything actually. I sincerely hope South End doesn't turn into the kind of place filled with bars like this...",1,2,1869,346
"Despite us both getting a little bit \""sick\"" the next day, the food was delicious.  Not sure how you rate a restaurant when that happens, but we will probably go back!\n\nEdit:  Went back.  Delicious as always.  Waitress was nice, but probably too sick to be working.",3,4,268,46
"First time I have ever had anything from here. A friend ordered the red velvet bundt cake with cream cheese frosting. The cake itself was delicious, but the frosting was a tad too rich for me. I can't wait to try the other cakes they make.",3,4,239,46
"I get really annoyed with these \""fancy\"" hotels who don't offer the refrigerator and microwave in their standard rooms, which I can get at a Holiday Inn Express or a Comfort Inn for probably half the price.  \n\nAlso, for the love of all things holy, don't charge people for WiFi in 2011 after they already paid you an arm and a leg for a room that isn't worth it.  That is RIDICULOUS.\n\nThere's at least a half-mile walk (without a sidewalk) to anything except a small convenience store.\n\nThe room was comfortable enough, but no greater than any 3-star hotel I've ever stayed in.",1,2,584,102
"One oft favorite joints in Charlotte. Between the jazz band, etoufee, and shrimp& grits this place takes the cake.",4,5,114,19
Very slow service.  Been here 30+ minutes and my car still hasn't come thru the wash part yet.  No one seems to know why things are taking so long.,0,1,147,29
"hovering between 3 and 2 stars. Great look to this place, but, as many others have said the drinks are bit pricey.\n\n I found the servers pretty abrupt as well.",2,3,161,30
This place is ridiculous! We have been waiting a half an hour for food in the drive through and no one has said anything to us. I don't care how good they say they are or how fresh the food is you should not have to wait in a drive through for a half hour. Forget what Food Network says this is definitely not Food Paradise. Avoid trying this place out \n!!!!!,0,1,360,72
"I just have to say its sad that I've not experienced some of the great wings I've heard so much about! I ordered chicken Parmesan and was so excited to dive into my half off happy hour wings! You get 10 whole wings for five bucks... That's gotta excite you! \n\nSad thing was, they were tasteless and greasy.  I kept biting into them thinking it would get better. I assure you, it did not. I ate three and had to stop.  It was like eating grease flavored chicken.  \n\nThe only redeeming thing about the meal was the tomato salad with huge pieces of mozzarella cheese. I really want to like this place... And I'll probably be back at some point. Heck, they still server beer.  That's good enough for me!\n\nHoping and wishing it will turn around though!",1,2,753,137
"This place was amazing, best AYCE in town! The customer service was very good and they had the cutest lil Asian waitress working haha. The Sex Bomb roll was delicious and so were every other roll we ordered!  Definitely coming back soon!",4,5,237,42
"This location of Hickory Tavern gets an extra star purely for the outdoor seating.  This is a great place to enjoy dining on the patio!  The view of our fair city is great!!\n\nAs for food, it's ok.  I have never had anything that blew me away, but I've never been disappointed, either.  I enjoy their \""build your own\"" salad menu, and the sandwiches and burgers are good.  \n\nThe bigger draw here is the walls that are plastered with TV's, so, it's a bar scene.  At this location it's a trendy crowd.  The wait-staff was really good.  I very much enjoyed our waitress on my most recent visit.\n\nThis is a good place to meet friends after work.. and don't forget to take in that view!",2,3,687,124
Great Peking Duck & Chinese Sausage Fried Rice!  Nice restaurant inside and great service.,3,4,90,14
