text,label_raw,stars,char_length,word_length
"I love that Bike Shop is a locally-owned place that really cares about the local biking community. They have a full calendar of group rides, and they host special events like ladies night where they have vendors in with specials and they go over simple maintenance, etc. \nI have gotten excellent advice from them, even when it didn't result in a sale.\nThe service is reasonably priced and the staff is very knowledgeable, but they do have a tendency to get backed up. I recently had to wait an entire week just to get a wheel trued, a process that probably took them about 20 minutes.\nThe shop has a decent selection of apparel and accessories, but they are extremely overpriced. I might go there to look at something, but then I would turn around and buy it on amazon or bikenashbar. Same is true with their bikes - all very expensive.",3,4,839,150
I love korean BBQ and I love Sura's style concept.  The restaurant is buffet style. You pick the meats and dishes that you wish to have and bring it back to your table to grill. A server will bring you drinks and clean your grill ever so often. \n\nThe food isn't bad but it isn't great. You might find some pieces of meet that are still frozen if you pick from the middle of the tray. \n\nI went to the restroom while eating here and witnessed an employee leaving the stalls without washing their hands only to later see her behind the buffet line serving meat.  True story. \n\nI was so disgusted I wanted to return back to the stall and puke. \n\nSince Sura's AYCE menu is around the same price of the others in town...I'd go elsewhere especially after using their restrooms.,1,2,778,143
"Not the first Texas Roadhouse I have been to (been to the Las Ceruces, NM and the west-side El Paso, TX location).  They all have good quality food that makes for a good dinner.  What made this one stand out?\n\nThe music was at a volume where we could actually have a conversation at the table.  I wish they would do this at all locations!  Usually, you can't hear yourself think in a Texas Roadhouse, at least from my other experiences.",3,4,438,80
"We were thrilled to finally get a Cafe Rio in our area.  However, after several visits we are ready to say goodbye to our new location and travel back to the Stephanie or Eastern locations.  The service here is horrible, the restaurant is freezing cold and the food is less than mediocre.  The servers are rude and when I ask for extra pico, I am treated like I am asking for something impossible!  \n\nIt is time for management to step-up and take control and make some much needed changes!!!",0,1,493,89
"If you have been to Disney or even Chi-fil-a this place will disappoint you with their horrible customer service. Perhaps when 80% of your staff are 18 yrs and younger you need to instill respect, courtesy and the customer is always right b/c they just dropped a freakin mini fortune on this crappy amusement park that post hours of operations for stores and restaurants as suggested times. And you only get 1 star because I couldn't leave it blank",0,1,448,79
"Oh the smell of Olive Garden.  Isn't that the most recognizable smell? I swear I think they pipe it into the vents.\n\nWhen I worked at PV mall I felt positively fancy to eat salad and bread sticks for lunch here.  And at $3.95 it was quite the bargain when it wasn't an official lunch menu item.  Now they've made it $5.95 for soup and salad w/ breadsticks which still isn't a bad deal.  But now of course it doesn't taste quite as good as when I thought it was healthy.\n\nAs for the other food, I was turned off when I had 2 different friends work there who specifically told me not to go there.  Well, not that it was bad or I'd get sick, but that it was to Italian food what Taco Bell was to Mexican food.  When they said that if I could microwave, I could cook at Olive Garden, I decided to trust them.  I'll admit I've been a few times with them when I'm with other folks who really really wanted to go.  The last time I went was maybe 9 months ago and what really struck me were the prices.  I can get fresh ingredients and real cooking for that price - and generally better service.  \n\nThe best thing I can say about this place is how many jobs it's given my friends over the years because they have such an amazing turn over they will hire just about anyone.  This is a great place to get a job to get server experience.  And once you've learned the art of hospitaliano, you can go get a better job.  Just like everyone else.  But it will still take at least 3 months for the smell of Olive Garden to get out of your clothes and your car.",1,2,1550,301
"I really enjoyed it. They did put ALOT of work into this place with even more crazy people to work the house. Somethings that really bugged me were the large groups we had to be in (4 to group would be a great/ isolation is key) and the unprofessional staff. We had two guys infront of us who were clearly intoxicated and ruined the entire event for us due to everytime someone approach them they were childish and mocked them back.  We told the staff inside the situation and if we could wait just to separate from them a bit but no help was offered and just told to  \""keep moving\"".  Once out side, we were told them same. \n\nGet the VIP tickets. The line outside with out them was crazier then ever.",1,2,704,133
"People working there are so rude. They chatting with coworker while I am waiting to check out. They told me to wait. And the cashiers so rude, no smile, anger faces. Make me feel uncomrtable.",0,1,191,35
"casual vegas dinner away in chinatown...upstairs plaza second floor...yakitori in izakaya fashion...beers, sake and shochu...japanese small plates dining...a pitcher of beer while browsing...standard skewers...beef tongue chewy, but not tough...hamachi kama juicy and meaty...large rolls fat for sharing...average in presentation, quality and taste...another pitcher of beer washing...wings, bacon wrapped mochi, agadashi tofu and additional skewers...standard izakaya selection...nothing memorable in presentation or taste, but cheap!...finish and back to the strip!",2,3,567,68
"I was a fan, but would not go back.... to many other places to try",3,4,66,15
"I have ordered both carryout and delivery from this Pizza Hut location and will continue to do so because customer service is excellent and they always have some pretty good deals going on. \n\nThe employees are very friendly, in-person and over the phone. They don't mind going over all specials that they have and they always apologize if the pick up line gets long. Also, the food is always hot, fresh, and ready or delivered on time. It may not be the best pizza out there, but I think its still pretty good for the price.\n\nHere are some of the deals they have right now:\n-Mondays: 2 medium pizzas (up to 3 toppings) for $6 each\n-Tuesdays: $10 pastas\n-Wednesdays: wings are $.50 each\n-Carryout special: $10 large pizzas (up to 3 toppings). I always take advantage of this one!\n(and no, I do not work there, haha!)\n\nThey are also located near Yogoyum, my favorite frozen yogurt place!",4,5,896,153
"The place is always full of people so I was really looking forward to trying out their ramen.  Ramen-Ya is also referred as Kurobuta Izakaya.  Kurobuta is berkshire pork, the very best.  It's a pork equivalent of Kobe beef.  We went for an early lunch on a Saturday.  Unfortunately the ramen simply falls short, because of their broth.  Ramen broths are tricky to make.  It needs to be fresh, rich and flavorful.  Their broth is fresh, but lacks the other two essentials.  Maybe that why it's called Ramen-Ya when I search it in Yelp.  :-)",2,3,539,95
"This place, is my little piece of heaven on earth. I am always looking for an excuse to go. I LOVE their macaroons. The salted Carmel is my very favorite. These macaroons are almost identical to the ones in Paris. \n\nI also love their lavender lemonade and other drink concoction. They have an amazing selection of other wonderful pastries. Also their soups and sandwiches are very good too.",4,5,392,68
"CAPRIOTTI'S!!! Y U NO get my order right??\n\nI came to this location for the first time today and ordered four sandwiches. Two of the four came out right.\n\nMy sister is boring and she likes her sandwiches with almost nothing on them. I am the opposite. I like my sandwiches Primanti's-style--filled to the brim and only edible if you kind of tilt your head sideways and gnaw at them. So, you can imagine my sadness when I got home and my sandwich turned out to be the vegetarian version of my sister's (turkey, cheese, lettuce.) It was a mere ghost of what a sandwich should be. I even asked for pickles and of course, there were no pickles. :(\n\nThe other issue is that I asked for wheat on my sister's sandwich. Maybe there was a communication problem, since the person who took my order handed it off to someone else.\n\nOn the plus side, my sandwich was good (at least the \""meat\"" was correct!) and the employees could not have been nicer. Capriotti's sandwiches are so good that I'll keep coming back despite service issues (until I find a replacement.)",1,2,1063,188
Wow! This place was pretty disappointing! At 7pm the food all seemed dried out and like it had been sitting there for hours! When they did bring out fresh it was only maybe two spoonfuls of the item. So my fried and I could never both try the fresh serving unless we rushed when we saw the lady carrying out the tray which didn't work well with other customers wanting to try the fresh serving as well!,0,1,402,77
"Not going back. Went in on a Sunday at 3pm to get take out. Waited what seemed like a long \""10 minutes\"" for nobody to be in there at the time. Drove 5 minutes home. Turkey burger looked like a McDonalds chicken nugget and had wilted lettuce. Tasted ok but nothing great. Got the mixed fries. They were nearly cold and getting mushy. The regular fries tasted like cardboard. I even spit one out that was just pure cold grease. Sweet potato fries were too thin. I would guess they made the fries first and then the burgers took awhile longer so we ended up with cold fries when we got home. Not sure this place will last if they don't improve!",1,2,643,122
"Bad service\nPubic hair and make up on \""clean\"" towel\nDirty room\n3 out of 3 restaurants on property\nDelivered sub-standard food quality and service.\nInsect in bed (see photo)\nWill never return.\nEnough said.",0,1,213,28
"The location is convenient considering I live in North Las Vegas. The drinks were good but they're overpriced. The amount you pay for a large is the same as the biggest boba drink at No.1 Boba. Except the size of a large at Tea Time is the same as a medium at No.1 Boba. And the regular sized boba should be called small, not regular. They were good but not worth it to me.",1,2,373,74
"Heard a lot about Studio B. Supposedly it's Las Vegas best buffet in 2010.\n\nInterior: Large place, lots of places to eat yummy food. No big lines at the food counters.\n\nService: I waited 4 hours from 4:45 to 8:45. I was not happy. For $30, the food is great...but not worth the 4 hour wait..\n\nFood: Quality stuff, prime rib, oysters, crab legs, all sorts of desserts and foods :)\n\nOverall: I'm sure I wouldve enjoyed it a lot more if I wasnt sleepy, starving and tired. 3.5 stars.",2,3,488,86
"Wait wait wait... this place is still open? No, seriously? Um. I'm confused. No, I mean like, in business? Operating? A manager? Employees? Hours of operation? Transact monies? Uhhhhh. You sure? Because when you define \""Air\"" as a smoker's patio and \""Earth\"" as weird alien shit on the walls and \""Fire\"" as the burning of your ear drums and \""Water\"" as a place to buy really expensive drinks that dehydrate you, I just can't really comprehend how our $30k millionaire ballers can afford to keep this place going, even in an economic environment that protects only their class. But that's why I'm a $20k impoverished sycophantic parasite on our society. No business sense. \n\nTwo stars for the money they put into this place in the first place. And the elevator to the private VIP bullshit area. Classy. Retarded classiness.",1,2,828,139
"I love the food at Green. I've tried many other vegan restaurants in the valley and Green is by far my favorite. Please consider opening a Chandler location, I would be able to go way more often.",4,5,195,37
"The food here is typical mexican food and good, but nothing I would rave about. Nothing to complain about either. I really come here for the great location and unique building. My daughter loves sitting by the fish tank and I always seem to find a new place to get a great picture of her every time I visit. There really are quite a few very good spots for taking pictures. Service is good and this place reminds me of what Mexican places were like when I was a kid which is not a bad thing:) I'm looking forward to sitting at the little bar or in the open air lounge and having a margarita one day when I make the trip kid free.",3,4,629,124
"NOT much of breakfast eater but my cousin from Sac in town and decided too meet up with my brother and my nieces at their favorite breakfast joint. I have been too few times just never got around too reviewing it. One thing really like about The Cracked Egg location so close too the house plus if this one busy then go five min down the road too there free standing restaurant. (I never been). It kind of small place so depending when you go there chance wait. We all meet up on weekend and good thing went early because by 10am the place was insane and line out the door. Go early or late breakfast/lunch crowds not your thing. \n\nThe Coffee Cake the bomb. I went with chili cheese omelette. It was really good! It had right portion of chili and cheese. The seasoned potatoes without doubt MY FAVORITE things on the menu. Sure you seasoned potatoes at any breakfast joint but the thing stands out for me is the seasoning mix they put on them. I have no idea it is. All I know is potatoes are addicting could eat plate of potatoes be in complete bliss. I put some ketchup on them but really tasty eat them by themselves. They nice HOT. Crispy on the outside. I also had the sandwiches on the menu are solid and makes for great breakfast/lunch. One thing after spoiling myself with Red Velvet Pancakes at BabyStack wish they had some too. It one type of pancakes they don;t have but have other yummy options comes too pancakes. Everything on the menu is solid had few things on the menu and loved it!\n\nThe service had always been great! Even when its super busy the service always been great, staff if very friendly, and great way too start the day with meal at The Cracked Egg. =))",3,4,1685,314
Not good!\nService was wanna-be professional and food was average at most and WAY overpriced (had lamb for $100!).,0,1,114,18
"I'm surprised to see so many 5 star reviews, I had a very bad experience here!\n\nI went here the other day based off of the reviews on yelp... What a big mistake!!!\n\nI simply went to get my eyebrows done the lady was very friendly and asked if I had my eyebrows threaded before which I have. So she's doing my brows and she asks if I'm ok because I guess I looked like I was in a lot of pain.. Which I was in alot of pain I've never had it hurt that bad when getting my brows threaded it felt like my skin was being pulled off. So anyways she finishes and hands me the mirror they looked ok she had missed a few spots and my skin was red and irritated but I figured it would heal. \n\nSo the next day I wake up and looked in the mirror and I see my skin was ripped in several spots I had bumps and blood stains from her pulling at my skin, on top of that I noticed she had missed more then just a few spots of hair there was tons of hairs left! \n\nI will not be returning here it was a waste of money and I had to get my eyebrows done 5 days after she had did them. Not to mention she damaged my skin!",0,1,1105,230
"If there was an option to review without any stars this would be a great case. I was very upset and chose to not tell her how I felt. I went in for a brow wax and came out with thin uneven eyebrows. I was very specific that I just wanted a clean up and did not want the actual eye brow messed with. When I looked at them I noticed half my eyebrow was missing. The woman tried to tell me that I was not looking at them correctly. How can you employ or authorize someone to do a service they cannot perform? I will never ever walk into Regis again.  Biggest mistake ever.\n\n**side note: i was washing my face and my left eyelid burned, i looked in the mirror and saw that either i have a burn or my skin was lifted. Seriously? Shitty eyebrows and now skin missing??",0,1,764,151
Carne Asada tacos are to die for. Had four at $1.10/each and was pleasantly full to the gills. Will return next time in the area.,4,5,129,25
Food and service are excellent. Only thing keeping it from 5 stars is price...expect to spend a couple more dollars per dish than other sports bar menus.,3,4,153,27
"A gift shop with a difference.\n\nThe clue to the first difference is one word on the outside: weaponry.  To any man, this is going to spark interest.  They have a small range of different swords of varying sizes and types.  According to the DO NOT TOUCH signs, they were battle-ready and sharp (this just makes me want to touch them all the more, but I did manage to resist the temptation).\n\nThe quality of the items in this shop is a bit higher than in many of the others in the city, and there was also  a small range of teddy bears, which is something that you don't often see.  I was also welcomed into the shop by the owner, greeting me with a smile and a hello.  This is so rarely seen in shops these days, and it's good to see that they're interested in everyone that comes through the doors.\n\nOn the whole, I would recommend a visit to Neanie Scott if you're looking for a gift or trinket to give to a friend or relative.",2,3,934,176
"I finally made it here! I have been Yelp Stalking it for what seems like forever, but it is rare I can journey across town during the week. I arrived around 12:30 and the place was hoppin! Oliver was very nice and I ordered the Blue and Brie..Chicken, Apples,  Walnuts,Blue and Brie Cheeses, and a bit of mustard..it was SO yum! I told him I worked at UNLV and he let me know he graduated in 2001! Very cool to have a local rebel running a great place! I got an Iced Tea which was fresh brewed and very delicious. I hope to try some of the sweets next time..I am trying to be good, but this place is worth a cheat day for sure!!",4,5,628,125
"MONTE CARLO, an awesome name brand.We asked for a non-smoking room and we were sent into a SMOKING ROOM.I noticed that the carpet floor near the window had a minor crack.The room was NOT clean.The hotel was not nice because it is old.I will never stay in this hotel again and this hotel made me wonder why MGM Mirage made horrible hotels and never keep the old ones clean for there customers.Also,MGM's customer service need improvements.Stay at the Monte Carlo if you want a bad stay and want a feel of BARFED OUT EUROPE.This hotel is Sub-standard and below average.\n\n\nMonte Carlo,a great name,and a great disappointment.",1,2,625,106
"Jack Clubman got his first scheduled (now, read that word the Brit way) maintenance today at Mini of Tempe.\n\nWe want to thank Steven Pham, our Service Consultant, and all of the crew at MOT for providing us with a great experience. Everyone was very welcoming and attentive to our needs and the facility is beautiful.\n\nJack was serviced nicely and even got a wash and vacuuming.\n\nIf you are in the greater Phoenix area, we highly recommend Mini of Tempe.\n\nwww.minioftempe.com",4,5,483,78
"I've heard alot about Round Table from Californians.  At first I was shocked that they charged $20 for a large pizza which would feed about 3 people.  For less, you can go to Dom Demarco's or Grimaldi's.\n\nBut I have to say that the Chicken and Garlic was quite tasty.  The creamy garlic sauce is really addicting.  I think it would be awesome if you get a side on the side to dip your pizza in - kind of like Papa John's.\n\nWhat I like is that the crust on the bottom is crisp and the body of the crust has the nice chewy texture.  The crust experience was quite unique for a chain.  The leftovers were even better the next day.   My method is to nuke it for 30-40 seconds and finish it off on a cast iron.  It provides the same experience you have when eating there.\n\nI'll be back for their Mon-Sat lunch buffet.  Without the use of a groupon, I don't know if i would go back outside of the buffet especially when I believe you can get much better value and experience at Grimaldi's or Dom Demarco's.\n\nBut the pizza here was still really good.  3.5 stars.",2,3,1063,198
"I was surprised to find that had a TON of brand new irrigation supplies. As a gardener, I am always fiddling with the irrigation, and am in constant need of emitters, hose, and connectors to support my filthy habit. They have it all (at least when I went), and at a fraction of what the hardware store charges.",2,3,310,58
This time I went online to the web sight and scheduled an appointment. I made it for 8:30am and i got called back at 8:35am. Not to bad!!\nThey were very busy. If u did not have an appointment they had an hour wait!!\nMake an appointment for any blood work,2,3,256,49
Most overpriced mediocre Asian food ever.  Everything tasted like something you could get at a fast food Chinese restaurant.  It's ridiculous that they charge $18 for a plate of vegetables and $28 for some rice porridge.  I don't understand why people even come here!  \n\nI would never choose to eat here if I was actually paying for it.,1,2,338,58
"This review is only for the club.\nThis new club has quite the line up of DJ's, and the weekend we were there Tiesto was spinning on Sat night! Being that he is among the top DJ's on the planet, we figured it would be packed so, of course, I turn to my fellow Yelpsters for advice...\nLet me confirm and clear up a few things now that I have been there. \nFirst the nerve-wrecking stairs, this is a 5 story spot, but the club is only 3 stories. You enter on the main floor, so if you are there for EDM, stay there and no stairs. The main floor is the middle, so if you are there for hip-hop go downstairs, and now I can see a problem.\nSecond the non-VIP seating policy, there actually are places to sit for non-VIP. If you go downstairs, damn stairs!, you have two directions at the bottom, straight in the main room or do a 180 and walk down the hall. The back room is open seating, at least until the promoters sell the seat as VIP, but to us it seamed like we had a place to sit all night. Plus those bartenders are way less busy and hoooook it up!\nThird the nice staff, this one is true! These were without a doubt the nicest bouncers and bartenders we had ever dealt with, and we have been to clubs from SF to Ibiza. It was a much better feel than the normal steroid-staredown that you get from most clubs in Vegas. \nFourth the dress code, this is normal for Vegas, smart casual. A previous post mentions flip-flops, I did not see any, but let's face it a dress code is 99.9% for the guys so maybe she did sneak in with them on...\nFifth the music in the hip hop room, the posts about the gangster rap are probably from people that did not stay down there long enough, we really felt there was a good mix of many genres of hip hop, but we were there for Tiesto!\nLast the dance floor, prior posts are accurate, there is little to no dance floor for a club that holds 5000 people. The main dance floors get so packed that it becomes more of a collective fist pump rather than dancing. We found that upstairs was the better place to dance. There is an open area up there, and while not technically a dance floor, we sure turned it into one! Oh and you can see the DJ booth from up there, if you look through the VIP's lining the rail. \nThe lack of dance floor space is the reason I knocked a star off. All in all this is a great club, and with DJ's like Tiesto how can you go wrong.",3,4,2389,466
"Love this place! Now, to start, I am NOT a Crepe aficionado but that does not stop me from loving good food. I went here last night for the first time with a friend. We started off with some wine,which they have a good but small selection as they do the beer list. When we sat down we tried the Cellar Plate which contained 2 different gourmet meats and cheeses with crusty bread. It was OK but a little skimpy for me. On to dinner, I really wanted to try the fish and chips but hesitated due to the bad reviews it's received on Yelp so instead I  opted for  the Sausage and Peppers Crepe and my friend ordered the Spinach/Mushroom Crepe. I was blown away with the amount of food that they served. My Crepe covered the entire plate and my friends' consisted of 2 large Crepes traditionally rolled. I will say that the sides that we ordered were not needed due to the generous portion of our entree. The Sausage was cooked perfectly and had just the right amount of flavor. I was not expecting that as most places I find just don't have good sausage. My friend loved her meal as well. \n\nThe seating was very limited and very close together which gave it a cozy feel but you can definitely hear everyone elses coversation. I like smaller restaurants like this because they are more representative of the locals. The staff was very friendly too. Great place for a first date or just a romantic date with your favorite person. Needless to say, I will be returning here in the near future. Only this time I will try those Pesto Brie fries that everyone is talking about!",4,5,1567,290
